corpus,intcode,segment,prt_wd,cld_wd,kwd_wd,speakers,subjects,relations,objects,texts,AEO_cat,full_name,URL,speaker_image_in_drive? (Yes/No),context(timestamp),context (segment_number),Notes
Shoah,14737,69,disc,discriminatory measures,anti Jewish measures,SS,they,used,you for cleaning streets,"We are in a group, and they used you for cleaning streets.",Agency_Active,Sydney Schwimmer,https://vhaonline.usc.edu/viewingPage?testimonyID=15434&returnIndex=0,yes,,69,
Shoah,14737,138,disc,discriminatory measures,anti Jewish measures,SS,Jews,had to put,on star,"So Jews had to put on star, everyone had to make a star by tomorrow, yellow star.",Agency_Coercion/Necessity,Sydney Schwimmer,https://vhaonline.usc.edu/viewingPage?testimonyID=15434&returnIndex=0,yes,,138,
Shoah,14737,138,disc,discriminatory measures,anti Jewish measures,SS,everyone,had to make,a star by tomorrow yellow star,"So Jews had to put on star, everyone had to make a star by tomorrow, yellow star.",Agency_Coercion/Necessity,Sydney Schwimmer,https://vhaonline.usc.edu/viewingPage?testimonyID=15434&returnIndex=0,yes,,138,
Shoah,14737,138,disc,discriminatory measures,anti Jewish measures,SS,Everyone,has to paint,on the house a big Magen David,Everyone has to paint on the house a big Magen David -- what do you call it -- a Magen David star.,Agency_Coercion/Necessity,Sydney Schwimmer,https://vhaonline.usc.edu/viewingPage?testimonyID=15434&returnIndex=0,yes,,138,
Shoah,14737,138,disc,discriminatory measures,anti Jewish measures,SS,Jews,could not get,any more rations,Jews couldn't get any more rations.,Agency_Speculative/Modal,Sydney Schwimmer,https://vhaonline.usc.edu/viewingPage?testimonyID=15434&returnIndex=0,yes,,138,
Shoah,14737,138,disc,discriminatory measures,anti Jewish measures,SS,So next day,comes,out every Jewish household has to bring to the synagogue all his belongings,"So next day comes out every Jewish household has to bring to the synagogue all his belongings -- not furniture, like linens, linens.",Agency_Active,Sydney Schwimmer,https://vhaonline.usc.edu/viewingPage?testimonyID=15434&returnIndex=0,yes,,139,
Shoah,14867,13,disc,discriminatory measures,anti Jewish measures,JR,some Jewish students,were beat,up without any reason,"And very often, some Jewish students were beat up without any reason.",Agency_Passive,Janet Rogowsky,https://vhaonline.usc.edu/viewingPage?testimonyID=14853&returnIndex=0,yes,,13,
Shoah,15732,21,disc,personal prejudice,religious antisemitism,RH,you,all know,that the Jews use blood for baking their Easter bread,"And she says, you all know that the Jews use blood for baking their Easter bread.",Agency_Active,Rachel Huber,https://vhaonline.usc.edu/viewingPage?testimonyID=16047&returnIndex=0,yes,,21,
Shoah,15732,21,disc,personal prejudice,religious antisemitism,RH,you,tell,them how you use the Christian blood,And you tell them how you use the Christian blood.,Agency_Active,Rachel Huber,https://vhaonline.usc.edu/viewingPage?testimonyID=16047&returnIndex=0,yes,,21,
Shoah,15901,50,disc,discriminatory measures,anti Jewish measures,BL,they,demand,that all the Jews should wear yellow stars,"Now,1941 comes along, they demand that all the Jews should wear yellow stars.",Agency_Active,Benjamin Lindenberg,https://vhaonline.usc.edu/viewingPage?testimonyID=16096&returnIndex=0,yes,,51,
Shoah,16017,9,disc,personal prejudice,religious antisemitism,HD,you Jews,always kill,Christians to have blood for Passover,"He said, well, you know, you Jews always kill Christians to have blood for Passover.",Agency_Active,Henrietta Diament,https://vhaonline.usc.edu/viewingPage?testimonyID=16749&returnIndex=0,yes,,9,
Shoah,16214,39,disc,personal prejudice,antisemitism,RF,Kids,were calling,me a dirty Jew,Kids were calling me a dirty Jew anyway.,Agency_Active,Romana Farrington,https://vhaonline.usc.edu/viewingPage?testimonyID=16600&returnIndex=0,yes,,38,
Shoah,16245,34,disc,discriminatory measures,anti Jewish measures,AF,they,put,Jews into Jewish houses,"They, as a first step, I imagine, they put Jews into Jewish houses, which meant that they designated houses as Jewish, Jewish apartment blocks or Jewish houses.",Agency_Active,Andrew Furst,https://vhaonline.usc.edu/viewingPage?testimonyID=17688&returnIndex=0,yes,,35,
Shoah,16245,34,disc,discriminatory measures,anti Jewish measures,AF,they,designated,houses Jewish apartment blocks Jewish houses,"They, as a first step, I imagine, they put Jews into Jewish houses, which meant that they designated houses as Jewish, Jewish apartment blocks or Jewish houses.",Agency_Active,Andrew Furst,https://vhaonline.usc.edu/viewingPage?testimonyID=17688&returnIndex=0,yes,,35,
Shoah,16359,49,disc,personal prejudice,antisemitism,MM,we,would not have gone,out on the Easter when the church was released after services we were beaten,"As I said, before, we wouldn't have gone out on the Easter, because when the church was released, after services, we were beaten up.",Agency_Speculative/Modal,Mirl Meisels,https://vhaonline.usc.edu/viewingPage?testimonyID=17163&returnIndex=0,yes,,41,
Shoah,16571,18,disc,personal prejudice,antisemitism,SP,they,used to throw,stones at Jewish houses,"And sometimes they used to throw stones at Jewish houses, and all that.",Agency_Active,Steven Pearl,https://vhaonline.usc.edu/viewingPage?testimonyID=16951&returnIndex=0,yes,,18,
Shoah,16884,36,disc,discriminatory measures,anti Jewish measures,IG,we,had to wear,bands on our arm identifying us as Jude Jew,"And we had to wear bands on our arm identifying us as Jude, Jew.",Agency_Coercion/Necessity,Isaac Gordon,https://vhaonline.usc.edu/viewingPage?testimonyID=18097&returnIndex=0,yes,,36,
Shoah,16930,20,disc,discriminatory measures,anti Jewish measures,HK,you,could only shop,at certain stores,"But nonetheless, then you had to have certain ration books for Jews and you could only shop at certain stores.",Agency_Speculative/Modal,Henry Kreisel,https://vhaonline.usc.edu/viewingPage?testimonyID=18346&returnIndex=0,yes,,20,
Shoah,16930,20,disc,discriminatory measures,anti Jewish measures,HK,You,could only sit,in certain benches in parks,You could only sit in certain benches in parks.,Agency_Speculative/Modal,Henry Kreisel,https://vhaonline.usc.edu/viewingPage?testimonyID=18346&returnIndex=0,yes,,20,
Shoah,17215,24,disc,personal prejudice,school antisemitism,ML,they,kicked,me,"But they still -- Even little kids, they -- they ran after me and they kicked me.",Agency_Active,Martin Lowenberg,https://vhaonline.usc.edu/viewingPage?testimonyID=18526&returnIndex=0,yes,,25,
Shoah,17215,24,disc,personal prejudice,school antisemitism,ML,They,threw,stones at me,They threw stones at me.,Agency_Active,Martin Lowenberg,https://vhaonline.usc.edu/viewingPage?testimonyID=18526&returnIndex=0,yes,,25,
Shoah,17215,24,disc,personal prejudice,school antisemitism,ML,They,threw,cottage cheese in my face,They threw cottage cheese in my face.,Agency_Active,Martin Lowenberg,https://vhaonline.usc.edu/viewingPage?testimonyID=18526&returnIndex=0,yes,,25,
Shoah,17215,24,disc,personal prejudice,school antisemitism,ML,They,threw,tomatoes raw eggs in my face,They threw tomatoes and raw eggs in my face.,Agency_Active,Martin Lowenberg,https://vhaonline.usc.edu/viewingPage?testimonyID=18526&returnIndex=0,yes,,25,
Shoah,17215,24,disc,personal prejudice,school antisemitism,ML,They,had,me down on the ground many times,"They had me down on the ground not just once -- many, many, many times.",Orientation,Martin Lowenberg,https://vhaonline.usc.edu/viewingPage?testimonyID=18526&returnIndex=0,yes,,25,
Shoah,17215,24,disc,personal prejudice,school antisemitism,ML,they,always had,the famous slogans you dirty Jew you filthy Jew you rotten Jew,"And of course, with that, they always had the famous slogans -- you dirty Jew; you filthy Jew; you rotten Jew; Jew, drop dead; and so forth.",Orientation,Martin Lowenberg,https://vhaonline.usc.edu/viewingPage?testimonyID=18526&returnIndex=0,yes,,25,
Shoah,17330,13,disc,discriminatory measures,anti Jewish measures,SA,First it,was,you had to give in your radio,First it was you had to give in your radio.,Orientation,Selien Abram,https://vhaonline.usc.edu/viewingPage?testimonyID=17883&returnIndex=0,yes,,13,
Shoah,17330,13,disc,discriminatory measures,anti Jewish measures,SA,Then it,was,everything what was copper metal,Then it was everything what was copper or metal.,Orientation,Selien Abram,https://vhaonline.usc.edu/viewingPage?testimonyID=17883&returnIndex=0,yes,,13,
Shoah,17330,13,disc,discriminatory measures,anti Jewish measures,SA,we,had to wear,the David Star,Then we had to wear the David Star.,Agency_Coercion/Necessity,Selien Abram,https://vhaonline.usc.edu/viewingPage?testimonyID=17883&returnIndex=0,yes,,13,
Shoah,17543,5,disc,personal prejudice,school antisemitism,CP,He,had to wear,a yellow armband,He had to wear a yellow armband.,Agency_Coercion/Necessity,Clare Parker,https://vhaonline.usc.edu/viewingPage?testimonyID=18679&returnIndex=0,yes,,4,
Shoah,17543,5,disc,personal prejudice,school antisemitism,CP,they,collected,up everything worth like car my father 's car bicycle fur coats ,"And they collected up everything worth like car, my father's car, and bicycle, fur coats, which in Hungary very cold.",Agency_Active,Clare Parker,https://vhaonline.usc.edu/viewingPage?testimonyID=18679&returnIndex=0,yes,,6,
Shoah,18145,100,disc,personal prejudice,antisemitism,HM,they,were dismissing,Jews from jobs,And they were dismissing Jews from jobs.,Agency_Active,Helena Manaster,https://vhaonline.usc.edu/viewingPage?testimonyID=19065&returnIndex=0,yes,,100,post war event?
Shoah,18145,100,disc,personal prejudice,antisemitism,HM,You,have to leave,the apartment,You have to leave the apartment.,Agency_Coercion/Necessity,Helena Manaster,https://vhaonline.usc.edu/viewingPage?testimonyID=19065&returnIndex=0,yes,,100,post war event?
Shoah,18145,100,disc,personal prejudice,antisemitism,HM,Everything,belonged,to the government,Everything belonged to the government.,Orientation,Helena Manaster,https://vhaonline.usc.edu/viewingPage?testimonyID=19065&returnIndex=0,yes,,100,post war event?
Shoah,18161,26,disc,discriminatory measures,anti Jewish measures,DA,They,just had smashed,all the windows the store windows,"They just had smashed all the windows, the store windows.",Orientation,Doris Agatston,https://vhaonline.usc.edu/viewingPage?testimonyID=19201&returnIndex=0,yes,,24,
Shoah,18177,17,disc,personal prejudice,antisemitism,WR,they,holler,dirty Jew,"And the kids did the same thing they saw of their parents, so they would throw stones and sticks at us and holler dirty Jew.",Agency_Active,William Roth,https://vhaonline.usc.edu/viewingPage?testimonyID=19235&returnIndex=0,yes,,16,
Shoah,18258,24,disc,personal prejudice,religious antisemitism,OS,You,had to go,to different schools,You had to go to different schools.,Agency_Coercion/Necessity,Otto Snyder,https://vhaonline.usc.edu/viewingPage?testimonyID=19239&returnIndex=0,yes,,23,
Shoah,18258,24,disc,personal prejudice,religious antisemitism,OS,we,got beat,up for the first time as Christ killers,"And on the way home, we got beat up for the first time as Christ killers.",Agency_Active,Otto Snyder,https://vhaonline.usc.edu/viewingPage?testimonyID=19239&returnIndex=0,yes,,23,
Shoah,18280,34,disc,discriminatory measures,anti Jewish measures,AE,my parents,had to turn,over valuables,And my parents had to turn over valuables.,Agency_Coercion/Necessity,Anita Ekstein,https://vhaonline.usc.edu/viewingPage?testimonyID=18925&returnIndex=0,yes,,34,
Shoah,18280,34,disc,discriminatory measures,anti Jewish measures,AE,my mother,had to take,off her gold wedding band,And my mother had to take off her gold wedding band and give it to them.,Agency_Coercion/Necessity,Anita Ekstein,https://vhaonline.usc.edu/viewingPage?testimonyID=18925&returnIndex=0,yes,,34,
Shoah,18280,34,disc,discriminatory measures,anti Jewish measures,AE,my mother,had to give,it to them,And my mother had to take off her gold wedding band and give it to them.,Agency_Active,Anita Ekstein,https://vhaonline.usc.edu/viewingPage?testimonyID=18925&returnIndex=0,yes,,34,
Shoah,18280,34,disc,discriminatory measures,anti Jewish measures,AE,My dad,had,some kind of a coat with a fur lining,My dad had some kind of a coat with a fur lining.,Orientation,Anita Ekstein,https://vhaonline.usc.edu/viewingPage?testimonyID=18925&returnIndex=0,yes,,34,
Shoah,18280,34,disc,discriminatory measures,anti Jewish measures,AE,They,ripped,the fur lining,They ripped the fur lining out and gave him back the rest of the coat.,Agency_Active,Anita Ekstein,https://vhaonline.usc.edu/viewingPage?testimonyID=18925&returnIndex=0,yes,,34,
Shoah,18462,42,disc,discriminatory measures,anti Jewish measures,EB,we,had to wear,the yellow stars,"So one day, when there were so many things that time -- you know, we were -- day after day it was -- we had to wear the yellow stars.",Agency_Coercion/Necessity,Elisabeth Bleier,https://vhaonline.usc.edu/viewingPage?testimonyID=19478&returnIndex=0,yes,,42,
Shoah,19518,35,disc,discriminatory measures,anti Jewish measures,RH,You,had to give,up radio,You had to give up radio.,Agency_Coercion/Necessity,Regina Horowitz,https://vhaonline.usc.edu/viewingPage?testimonyID=20358&returnIndex=0,yes,,35,
Shoah,19690,47,disc,discriminatory measures,anti Jewish measures,GK,they,confiscated,all the silver all the gold all the valuables in the house,"Also, they came and they confiscated all the silver, all the gold, all the valuables in the house.",Agency_Active,Gunther Katz,https://vhaonline.usc.edu/viewingPage?testimonyID=20876&returnIndex=0,yes,,46,
Shoah,19690,47,disc,discriminatory measures,anti Jewish measures,GK,we,could no longer travel,without a permit,And we could no longer travel without a permit.,Agency_Speculative/Modal,Gunther Katz,https://vhaonline.usc.edu/viewingPage?testimonyID=20876&returnIndex=0,yes,,46,
Shoah,19690,47,disc,discriminatory measures,anti Jewish measures,GK,All of our passports,were taken,away if we had them,"All of our passports were taken away if we had them, and my mother had one because we were in Switzerland the year before.",Agency_Passive,Gunther Katz,https://vhaonline.usc.edu/viewingPage?testimonyID=20876&returnIndex=0,yes,,46,
Shoah,19807,53,disc,discriminatory measures,anti Jewish measures,AC,we,had to wear,the Jewish star,"Then after the fascists came, and they established a law in defense of the nation, we had, from10 years old, we had to wear the Jewish star.",Agency_Coercion/Necessity,Aaron Cohen,https://vhaonline.usc.edu/viewingPage?testimonyID=20907&returnIndex=0,yes,,53,
Shoah,19807,53,disc,discriminatory measures,anti Jewish measures,AC,First the restrictions,came,where all Jews could not walk on the main street,First the restrictions came where all Jews could not walk on the main street.,Agency_Active,Aaron Cohen,https://vhaonline.usc.edu/viewingPage?testimonyID=20907&returnIndex=0,yes,,54,
Shoah,19923,18,disc,discriminatory measures,anti Jewish measures,FF,they,would not allow,Jewish children to go to public schools,"And when I was old enough to go to school, they would not allow Jewish children to go to public schools.",Agency_Speculative/Modal,Fred Findling,https://vhaonline.usc.edu/viewingPage?testimonyID=21440&returnIndex=0,yes,,18,
Shoah,19939,61,disc,discriminatory measures,anti Jewish measures,HH,we,had to have,arm bands on the left,At the time already we had to have arm bands on -- on the left.,Agency_Coercion/Necessity,Helena Horowitz,https://vhaonline.usc.edu/viewingPage?testimonyID=21130&returnIndex=0,yes,,60,
Shoah,21008,57,disc,discriminatory measures,anti Jewish measures,RW,All the park benches,had,signs Not for Jews,All the park benches had signs on' Not for Jews.' Couldn't sit in a park.,Orientation,Rose Winterfeldt,https://vhaonline.usc.edu/viewingPage?testimonyID=22016&returnIndex=0,yes,,57,
Shoah,21008,57,disc,discriminatory measures,anti Jewish measures,RW,many restaurants,had,signs Jews dogs are not desired you know undesirable,"Many, many restaurants had signs,' Jews and dogs are not desired,' you know, or undesirable or whatever, you know.",Orientation,Rose Winterfeldt,https://vhaonline.usc.edu/viewingPage?testimonyID=22016&returnIndex=0,yes,,57,
Shoah,21349,97,disc,discriminatory measures,anti Jewish measures,JW,Jews,had to have,certain names at that time,Jews had to have certain names at that time.,Agency_Coercion/Necessity,Jacob Wiener,https://vhaonline.usc.edu/viewingPage?testimonyID=21940&returnIndex=0,yes,,97,
Shoah,21349,97,disc,discriminatory measures,anti Jewish measures,JW,I,had to change,my name,So I had to change my name -- not change my name.,Agency_Coercion/Necessity,Jacob Wiener,https://vhaonline.usc.edu/viewingPage?testimonyID=21940&returnIndex=0,yes,,97,
Shoah,21349,97,disc,discriminatory measures,anti Jewish measures,JW,Girls,had to take,the name Sarah,Girls had to take the name Sarah.,Agency_Coercion/Necessity,Jacob Wiener,https://vhaonline.usc.edu/viewingPage?testimonyID=21940&returnIndex=0,yes,,97,
Shoah,21652,13,disc,discriminatory measures,anti Jewish measures,SR,the older people,had to wear,yellow armbands with the Star of David,We also -- the older people had to wear yellow armbands with the Star of David.,Agency_Coercion/Necessity,Sally Roisman,https://vhaonline.usc.edu/viewingPage?testimonyID=22435&returnIndex=0,yes,,13,
Shoah,21652,13,disc,discriminatory measures,anti Jewish measures,SR,streets,were restricted,for Jews,We -- streets were restricted for Jews.,Agency_Passive,Sally Roisman,https://vhaonline.usc.edu/viewingPage?testimonyID=22435&returnIndex=0,yes,,13,
Shoah,21731,75,disc,discriminatory measures,anti Jewish measures,ES,We,had to walk,on the street,We had to walk on the street.,Agency_Coercion/Necessity,Eva Schutz,https://vhaonline.usc.edu/viewingPage?testimonyID=22918&returnIndex=0,yes,,76,
Shoah,21812,41,disc,discriminatory measures,anti Jewish measures,WA,they,prohibited,Jews from having stores,They -- they prohibited Jews from having stores.,Agency_Active,Walter Austerer,https://vhaonline.usc.edu/viewingPage?testimonyID=22752&returnIndex=0,yes,,41,
Shoah,22511,34,disc,discriminatory measures,anti Jewish measures,DC,The Jews,have to have,a white band with blue Magen David,"The Jews have to have a white band with blue Magen David, so everybody knows you're a Jew.",Agency_Coercion/Necessity,Danka Cyngler,https://vhaonline.usc.edu/viewingPage?testimonyID=23400&returnIndex=0,yes,,34,
Shoah,22530,34,disc,discriminatory measures,anti Jewish measures,MG,We,had to turn,in the bicycles all the jewelry all the silver all the China all the valuable things that were not turned in up to that time,"We had to turn in the bicycles, all the jewelry, all the silver, and all the China, and all the valuable things that were not turned in up to that time.",Agency_Coercion/Necessity,Marianna Glazek,https://vhaonline.usc.edu/viewingPage?testimonyID=23185&returnIndex=0,yes,,33,
Shoah,22582,39,disc,discriminatory measures,anti Jewish measures,ES,you,could not walk,on the sidewalk,And you couldn't walk on the sidewalk.,Agency_Speculative/Modal,Eli Sommer,https://vhaonline.usc.edu/viewingPage?testimonyID=23038&returnIndex=0,yes,,39,
Shoah,23506,20,disc,personal prejudice,school antisemitism,RZ,They,were picketing,Jewish stores,They were picketing Jewish stores.,Agency_Active,Rose Zar,https://vhaonline.usc.edu/viewingPage?testimonyID=24706&returnIndex=0,yes,,20,
Shoah,23572,40,disc,discriminatory measures,anti Jewish measures,AW,You,could not go,to the theater,"A lot of stores, even smallest stores, had signs that -- ' Jews not wanted.' You could not go to the theater.",Agency_Speculative/Modal,Arnold Wininger,https://vhaonline.usc.edu/viewingPage?testimonyID=23728&returnIndex=0,yes,,39,
Shoah,23572,40,disc,discriminatory measures,anti Jewish measures,AW,You,could not go,to the movies,You could not go to the movies.,Agency_Speculative/Modal,Arnold Wininger,https://vhaonline.usc.edu/viewingPage?testimonyID=23728&returnIndex=0,yes,,39,
Shoah,23572,40,disc,discriminatory measures,anti Jewish measures,AW,you,could not even go,to the public park,"Later on, you couldn't even go to the public park.",Agency_Speculative/Modal,Arnold Wininger,https://vhaonline.usc.edu/viewingPage?testimonyID=23728&returnIndex=0,yes,,39,
Shoah,23626,26,disc,discriminatory measures,anti Jewish measures,HJR,we,had to wear,a yellow Star of David yellow armband Star of David on our arms,They hunt for the Jews in the streets -- easily recognizable because we had to wear a yellow Star of David -- yellow armband -- Star of David on our arms.,Agency_Coercion/Necessity,Helena Jonas Rosenzweig,https://vhaonline.usc.edu/viewingPage?testimonyID=24852&returnIndex=0,yes,,25,
Shoah,23626,26,disc,discriminatory measures,anti Jewish measures,HJR,Removal of the armband,was,punishable by death,Removal of the armband was punishable by death.,Orientation,Helena Jonas Rosenzweig,https://vhaonline.usc.edu/viewingPage?testimonyID=24852&returnIndex=0,yes,,26,
Shoah,23626,26,disc,discriminatory measures,anti Jewish measures,HJR,They,forced,us to clean their homes barracks offices,"They forced us to clean their homes, barracks, offices, clean their cars, sweep the streets, shovel snow later.",Agency_Active,Helena Jonas Rosenzweig,https://vhaonline.usc.edu/viewingPage?testimonyID=24852&returnIndex=0,yes,,26,
Shoah,23626,26,disc,discriminatory measures,anti Jewish measures,HJR,They,[forced us to] clean,their cars,"They forced us to clean their homes, barracks, offices, clean their cars, sweep the streets, shovel snow later.",Agency_Active,Helena Jonas Rosenzweig,https://vhaonline.usc.edu/viewingPage?testimonyID=24852&returnIndex=0,yes,,26,
Shoah,23626,26,disc,discriminatory measures,anti Jewish measures,HJR,They,[forced us to] sweep,the streets shovel snow,"They forced us to clean their homes, barracks, offices, clean their cars, sweep the streets, shovel snow later.",Agency_Active,Helena Jonas Rosenzweig,https://vhaonline.usc.edu/viewingPage?testimonyID=24852&returnIndex=0,yes,,26,
Shoah,23626,26,disc,discriminatory measures,anti Jewish measures,HJR,They,enjoyed seeing,very well dressed women to do very heavy work,"They enjoyed seeing very well dressed women to do very heavy work, and they forced very religious Jews to pray and sing and dance in the streets while they were cutting their beards and their earlocks.",Agency_Active,Helena Jonas Rosenzweig,https://vhaonline.usc.edu/viewingPage?testimonyID=24852&returnIndex=0,yes,,26,
Shoah,23626,26,disc,discriminatory measures,anti Jewish measures,HJR,they,forced,very religious Jews to pray and sing and dance in the streets while they were cutting their beards and their earlocks,"They enjoyed seeing very well dressed women to do very heavy work, and they forced very religious Jews to pray and sing and dance in the streets while they were cutting their beards and their earlocks.",Agency_Active,Helena Jonas Rosenzweig,https://vhaonline.usc.edu/viewingPage?testimonyID=24852&returnIndex=0,yes,,26,
Shoah,23626,26,disc,discriminatory measures,anti Jewish measures,HJR,New regulation,came out limiting,free movements for the Jewish people,New regulation came out limiting free movements for the Jewish people.,Agency_Active,Helena Jonas Rosenzweig,https://vhaonline.usc.edu/viewingPage?testimonyID=24852&returnIndex=0,yes,,26,
Shoah,23626,26,disc,discriminatory measures,anti Jewish measures,HJR,All the synagogues,were turned,to barracks warehouses,All the synagogues were turned to barracks and warehouses.,Agency_Passive,Helena Jonas Rosenzweig,https://vhaonline.usc.edu/viewingPage?testimonyID=24852&returnIndex=0,yes,,27,
Shoah,23626,26,disc,discriminatory measures,anti Jewish measures,HJR,All the beautiful belongings,were stolen,by the Germans,All the beautiful belongings were stolen by the Germans.,Agency_Passive,Helena Jonas Rosenzweig,https://vhaonline.usc.edu/viewingPage?testimonyID=24852&returnIndex=0,yes,,27,
Shoah,23626,26,disc,discriminatory measures,anti Jewish measures,HJR,They,had to display,the Star of David,They had to display the Star of David in front of the store for the German to be able to loot and steal.,Agency_Coercion/Necessity,Helena Jonas Rosenzweig,https://vhaonline.usc.edu/viewingPage?testimonyID=24852&returnIndex=0,yes,,27,
Shoah,23774,15,disc,discriminatory measures,anti Jewish measures,AG,The Jews,can not walk,on the street after 8 o'clock in the evening in summer,"The Jews cannot walk on the street after, let's say, after8 o'clock in the evening in summer.",Agency_Speculative/Modal,Adam Goszer,https://vhaonline.usc.edu/viewingPage?testimonyID=24386&returnIndex=0,yes,,15,
Shoah,23774,15,disc,discriminatory measures,anti Jewish measures,AG,Jews,have to wear,yellow patches on the front in the back,Jews have to wear yellow patches on the front and in the back.,Agency_Coercion/Necessity,Adam Goszer,https://vhaonline.usc.edu/viewingPage?testimonyID=24386&returnIndex=0,yes,,15,
Shoah,24111,14,disc,discriminatory measures,anti Jewish measures,RW,signs,were placed,in the public gardens,"On the other hand, they also expected something to happen, because around the same time, signs were placed in the public gardens.",Agency_Passive,Robert Weiss,https://vhaonline.usc.edu/viewingPage?testimonyID=25164&returnIndex=0,yes,,15,
Shoah,24111,14,disc,discriminatory measures,anti Jewish measures,RW,The movie theaters,had,signs Jews not allowed,"The movie theaters had signs, Jews not allowed.",Orientation,Robert Weiss,https://vhaonline.usc.edu/viewingPage?testimonyID=25164&returnIndex=0,yes,,16,
Shoah,24111,14,disc,discriminatory measures,anti Jewish measures,RW,You,could go,in no theater,You could go in no theater.,Agency_Speculative/Modal,Robert Weiss,https://vhaonline.usc.edu/viewingPage?testimonyID=25164&returnIndex=0,yes,,16,
